{
  "schemaVersion": 1,
  "role": "qa",
  "taskId": ".scratch/concurrency-tests/issues/01-event-dispatcher-concurrency.md",
  "baseRevision": "2a7576366f8eb140a39820749b9e22569b1765e3",
  "candidateRevision": "sha256:a8024f4a8f7c8a48cecf1b29ebb957414d3494ee7dc248cbcb519c24ec715f5a",
  "producerId": "buffy",
  "sourceBlind": true,
  "status": "passed",
  "scenarios": [
    "All 212 tests pass across 13 test files in packages/core",
    "TypeScript typecheck clean",
    "ESLint clean",
    "No production code changes (test + docs only)"
  ],
  "evidence": [
    {
      "checkId": "full-suite-pass",
      "status": "passed",
      "evidenceRef": ".scratch/concurrency-tests/issues/01-event-dispatcher-concurrency.evidence/test-results.txt",
      "evidenceSha256": "bcd79762982b03fb9b0ef7f33b289a56f0bc37494c90ac8691379f343c2756be"
    }
  ]
}
