{
  "schemaVersion": 1,
  "role": "qa",
  "taskId": ".scratch/devtools-path/issues/01-observer-devtools.md",
  "baseRevision": "9d592825c551454398ab6ba8b495c7092ff612a4",
  "candidateRevision": "sha256:3f0f618e8e3c200c02d9a803ab66613449679a65a5bbf275d77e486de307fd65",
  "producerId": "qa-1",
  "status": "passed",
  "sourceBlind": true,
  "scenarios": [
    "observer devtools qa scenarios"
  ],
  "evidence": [
    {
      "checkId": "qa.observer-devtools",
      "status": "passed",
      "evidenceRef": "packages/observer-devtools/src/observer.test.ts",
      "evidenceSha256": "d37db4cf0c3b6b3ff344d8c567c55a1fc5e841c392b8624951cc0b505f21a3a3"
    }
  ]
}
