{
  "schemaVersion": 1,
  "role": "hardener",
  "taskId": ".scratch/concurrency-tests/issues/01-event-dispatcher-concurrency.md",
  "baseRevision": "1985ce6d5133152dadb31c9c067f2077eb4f00db",
  "candidateRevision": "sha256:e168c825302fd12888551ebb2139b16fd05349076b20ff069a30340ef225bb7f",
  "producerId": "buffy",
  "sourceBlind": false,
  "status": "passed",
  "scenarios": [
    "Mutation testing on event-dispatcher.ts: 230 mutants, 149 killed, 2 timeout, 9 survived, score 94.38%",
    "Model-based command tests exercise subscribe/emit/complete/dispose interleaving with progress/critical overflow",
    "fc.scheduler() test verifies Promise resolution order across concurrent observers"
  ],
  "evidence": [
    {
      "checkId": "mutation-testing",
      "status": "passed",
      "evidenceRef": ".scratch/concurrency-tests/issues/01-event-dispatcher-concurrency.evidence/test-results.txt",
      "evidenceSha256": "98bb2405ac9154b55686193cce734e7a1f24caec89326060f8b5fce3e8698122"
    }
  ]
}
