{
  "schemaVersion": 1,
  "producerId": "observer-devtools-independent-hardener",
  "evidence": [
    {
      "checkId": "hardener.raw-log-fields",
      "status": "passed",
      "evidenceRef": "packages/observer-devtools/src/sinks.ts",
      "evidenceSha256": "e989fa12ddc2d740ad50a64d550a01a013f5d5d74631f3852b3e88da60f57a0c"
    },
    {
      "checkId": "hardener.redaction",
      "status": "passed",
      "evidenceRef": "packages/observer-devtools/src/support-bundle.ts",
      "evidenceSha256": "e39e0450b035aed18fda93a6bf58cf9b83db301d9e63e911b44b162337049ac0"
    },
    {
      "checkId": "hardener.cap-drops",
      "status": "passed",
      "evidenceRef": "packages/observer-devtools/src/observer.ts",
      "evidenceSha256": "4e665f24b885d7669893ba2cc51ebe20dcb2d811de7fe0c3ba36e3f2e9180e1c"
    }
  ],
  "taskId": ".scratch/devtools-path/issues/01-observer-devtools.md",
  "baseRevision": "2a7576366f8eb140a39820749b9e22569b1765e3",
  "candidateRevision": "sha256:45d766d558091f96b82c6f5d951be4e0a9412a09205acf4cd477eccdc7b519ef",
  "role": "hardener",
  "status": "passed",
  "scenarios": [
    "mutation-boundary hardening",
    "redaction and bounded sinks"
  ],
  "sourceBlind": false
}
