{
  "schemaVersion": 1,
  "role": "qa",
  "producerId": "qa-sourceblind-14",
  "status": "passed",
  "sourceBlind": true,
  "scenarios": [
    "fresh network-backed issue-sync checks for parent and five child projections",
    "ready-for-human status and operator-view model-floor semantics",
    "hierarchy, reciprocal dependency graph, shared integration paths, audit boundary, and bootstrap closeout requirements"
  ],
  "evidence": [
    {
      "checkId": "issue-sync-parent",
      "status": "passed",
      "evidenceRef": ".scratch/role-assurance/PRD.md",
      "evidenceSha256": "88e92435fcd0f4f2f9b282447b9943e48913a6cc3361934997223b0232730c49"
    },
    {
      "checkId": "issue-sync-seed",
      "status": "passed",
      "evidenceRef": ".scratch/harness-integrity/issues/00-role-work-items.md",
      "evidenceSha256": "10cac2f1c13b15083c56c929b1c86b8129efe457f0dfb69523573fff14779dc8"
    },
    {
      "checkId": "issue-sync-independent-roles",
      "status": "passed",
      "evidenceRef": ".scratch/harness-integrity/issues/05-independent-roles.md",
      "evidenceSha256": "abfaf4372b86999d8e90175820242fa6fd076371a5da9aa77563a407eaa42021"
    },
    {
      "checkId": "issue-sync-model-routing",
      "status": "passed",
      "evidenceRef": ".scratch/harness-integrity/issues/06-model-routing.md",
      "evidenceSha256": "36a84121e0a5e946aa4e0c0db7b8e439e374cc756a21c1b9802e4ad77bd4b577"
    },
    {
      "checkId": "issue-sync-postmortems",
      "status": "passed",
      "evidenceRef": ".scratch/harness-integrity/issues/07-feature-postmortems.md",
      "evidenceSha256": "05aeec13ad3da2f241b609fcd0f0bbb387fa6f119153d400984f846f608e5e97"
    },
    {
      "checkId": "issue-sync-feature-gauntlet",
      "status": "passed",
      "evidenceRef": ".scratch/harness-integrity/issues/08-feature-gauntlet.md",
      "evidenceSha256": "487591665e0eaa6dfdbc05bf2e782ddb810239ff28b0161c20898c8a031666b5"
    },
    {
      "checkId": "workflow-contract-audit",
      "status": "passed",
      "evidenceRef": ".scratch/harness-integrity/issues/00-role-work-items.md",
      "evidenceSha256": "10cac2f1c13b15083c56c929b1c86b8129efe457f0dfb69523573fff14779dc8"
    }
  ],
  "taskId": ".scratch/harness-integrity/issues/00-role-work-items.md",
  "baseRevision": "c51f9979a8e82ce9b60ac5b66f0b60185e376097",
  "candidateRevision": "sha256:15cf4bc153815a2a2664584b19f13551aaee59d61b6f86bb47260a2bd0e32c6b"
}
