{
  "schemaVersion": 1,
  "role": "qa",
  "producerId": "point-action-qa",
  "status": "passed",
  "sourceBlind": true,
  "scenarios": [
    "agent-work stage prints checklist after stage header",
    "agent-context ENVIRONMENT lists tool presence plus bootstrap hint; stripped-PATH pipeline exits 0",
    "verify-candidate fails fast with bootstrap message under stripped PATH; passes preflight in normal environment",
    "CONTRIBUTING orders bootstrap-tools before agent-context; markdownlint passes",
    "repo-local .tools/bin/gopls shim lets verify-candidate proceed past preflight; shim removed with no git trace"
  ],
  "evidence": [
    {
      "checkId": "qa.stage-checklist",
      "status": "passed",
      "evidenceRef": "scripts/agent-work",
      "evidenceSha256": "fd488a23f290b492edc8de95223b483d12d08872d96e822f19a1df9e5270f749"
    },
    {
      "checkId": "qa.agent-context-env",
      "status": "passed",
      "evidenceRef": "scripts/agent-context",
      "evidenceSha256": "68590576afbf00773ca17efe1ae276b6369f604730c039b1234018ac982ffb2c"
    },
    {
      "checkId": "qa.verify-preflight",
      "status": "passed",
      "evidenceRef": "scripts/verify-candidate",
      "evidenceSha256": "5520194bc1c724e66848740b7e09c93e823999aef780094cf273699033e9ffbf"
    },
    {
      "checkId": "qa.contributing-order-lint",
      "status": "passed",
      "evidenceRef": "CONTRIBUTING.md",
      "evidenceSha256": "84f4b59ba13110c41080b8a302cba1e1ba0453d207b5168268eb41b0d17dd15a"
    },
    {
      "checkId": "qa.local-gopls-shim",
      "status": "passed",
      "evidenceRef": "scripts/bootstrap-tools",
      "evidenceSha256": "15309c341c61c2bcd161191c5532368dc0deacc739863bf3a5a5b7da8fce20a9"
    }
  ],
  "taskId": ".scratch/agent-guidance/issues/01-point-of-action.md",
  "baseRevision": "1985ce6d5133152dadb31c9c067f2077eb4f00db",
  "candidateRevision": "sha256:97a748f30fd4a123c6784711574c0d79281f688ffc8175b9cf1a057e1f86e2dc"
}
