{
  "schemaVersion": 1,
  "role": "hardener",
  "producerId": "independent-hardener-final",
  "status": "passed",
  "sourceBlind": true,
  "scenarios": [
    "Attacked the declared dependency and hierarchy graph for self-edges, cycles, duplicate or missing nodes, non-reciprocal edges, parent mismatch, duplicate branches, and overlapping writable domains.",
    "Attacked bootstrap authority, Candidate and Evidence-directory exclusion, maintainer-only closeout, projection freshness, and status-transition boundaries.",
    "Attacked implementer-versus-challenge-role model floors, protected-surface escalation, repeated-failure escalation, unsupported hosts, and preservation of stronger unresolved findings.",
    "Attacked role-specific source access, independent invocation requirements, post-merge closeout, and the no-implementation planning boundary."
  ],
  "evidence": [
    {
      "checkId": "hardener-role-graph-and-authority",
      "status": "passed",
      "evidenceRef": ".scratch/harness-integrity/issues/00-role-work-items.md",
      "evidenceSha256": "10cac2f1c13b15083c56c929b1c86b8129efe457f0dfb69523573fff14779dc8"
    },
    {
      "checkId": "hardener-independent-role-contract",
      "status": "passed",
      "evidenceRef": ".scratch/harness-integrity/issues/05-independent-roles.md",
      "evidenceSha256": "abfaf4372b86999d8e90175820242fa6fd076371a5da9aa77563a407eaa42021"
    },
    {
      "checkId": "hardener-model-routing-policy",
      "status": "passed",
      "evidenceRef": ".scratch/harness-integrity/issues/06-model-routing.md",
      "evidenceSha256": "36a84121e0a5e946aa4e0c0db7b8e439e374cc756a21c1b9802e4ad77bd4b577"
    },
    {
      "checkId": "hardener-gauntlet-state-and-closeout",
      "status": "passed",
      "evidenceRef": ".scratch/harness-integrity/issues/08-feature-gauntlet.md",
      "evidenceSha256": "487591665e0eaa6dfdbc05bf2e782ddb810239ff28b0161c20898c8a031666b5"
    }
  ],
  "taskId": ".scratch/harness-integrity/issues/00-role-work-items.md",
  "baseRevision": "c51f9979a8e82ce9b60ac5b66f0b60185e376097",
  "candidateRevision": "sha256:15cf4bc153815a2a2664584b19f13551aaee59d61b6f86bb47260a2bd0e32c6b"
}
