{
  "schemaVersion": 1,
  "role": "hardener",
  "producerId": "point-action-hardener",
  "sourceBlind": false,
  "status": "passed",
  "scenarios": [
    "gopls preflight three-case matrix on new condition `[[ ! -x \"$repo_root/.tools/bin/gopls\" ]] && ! command -v gopls`: (1) PATH gopls present, no repo-local -> passes; (2) PATH gopls hidden + executable .tools/bin/gopls -> passes (file created then DELETED; .tools/ gitignored per .gitignore:6, git status clean afterwards); (3) neither present (PATH hidden + repo-local removed) -> fails fast",
    "repo_root hygiene: set at scripts/verify-candidate:4 via git rev-parse fallback, quoted at cd (line 5) and in [[ ! -x \"$repo_root/.tools/bin/gopls\" ]] (line 14); [[ ]] suppresses glob, quotes suppress word-splitting; extra probe: non-executable .tools/bin/gopls does NOT satisfy (-x, not -e): non-exec + PATH passes via PATH, non-exec + no PATH fails",
    "static gate shellcheck clean on scripts/verify-candidate; existing agent-work and agent-context suites still pass; git status clean after create/delete cycle"
  ],
  "evidence": [
    {
      "checkId": "hardener.gopls-path-present-passes",
      "status": "passed",
      "evidenceRef": "scripts/verify-candidate",
      "evidenceSha256": "5520194bc1c724e66848740b7e09c93e823999aef780094cf273699033e9ffbf"
    },
    {
      "checkId": "hardener.gopls-repolocal-exec-passes",
      "status": "passed",
      "evidenceRef": "scripts/verify-candidate",
      "evidenceSha256": "5520194bc1c724e66848740b7e09c93e823999aef780094cf273699033e9ffbf"
    },
    {
      "checkId": "hardener.gopls-neither-fails-fast",
      "status": "passed",
      "evidenceRef": "scripts/verify-candidate",
      "evidenceSha256": "5520194bc1c724e66848740b7e09c93e823999aef780094cf273699033e9ffbf"
    },
    {
      "checkId": "hardener.gopls-nonexec-fallthrough",
      "status": "passed",
      "evidenceRef": "scripts/verify-candidate",
      "evidenceSha256": "5520194bc1c724e66848740b7e09c93e823999aef780094cf273699033e9ffbf"
    },
    {
      "checkId": "hardener.repo-root-quoting",
      "status": "passed",
      "evidenceRef": "scripts/verify-candidate",
      "evidenceSha256": "5520194bc1c724e66848740b7e09c93e823999aef780094cf273699033e9ffbf"
    },
    {
      "checkId": "hardener.shellcheck-clean",
      "status": "passed",
      "evidenceRef": "scripts/verify-candidate",
      "evidenceSha256": "5520194bc1c724e66848740b7e09c93e823999aef780094cf273699033e9ffbf"
    },
    {
      "checkId": "hardener.existing-agent-work-suite",
      "status": "passed",
      "evidenceRef": "tooling/quality/agent-work.test.sh",
      "evidenceSha256": "f01c341b93f8a9cb23872ff2efa0aef8a9e0d7e842eabddc97b09475391c922f"
    },
    {
      "checkId": "hardener.existing-agent-context-suite",
      "status": "passed",
      "evidenceRef": "tooling/quality/agent-context.test.sh",
      "evidenceSha256": "503b05404856af8a295f5ff0fc4d373f18b29bd3a2992e7d6aa6de83a8678c71"
    }
  ],
  "taskId": ".scratch/agent-guidance/issues/01-point-of-action.md",
  "baseRevision": "1985ce6d5133152dadb31c9c067f2077eb4f00db",
  "candidateRevision": "sha256:97a748f30fd4a123c6784711574c0d79281f688ffc8175b9cf1a057e1f86e2dc"
}
